"line","song_id","song_name","artist_id","artist_name"
"Here's something I've learned about people.\n\nWe think we know someone, but the truth is that we only know the version of them they have chosen to show us. We know our friend in a certain light, but we don't know them the way their lover does. Just the way their lover will never know them the same way that you do as their friend. Their mother knows them differently than their roommate, who knows them differently than their colleague. Their secret admirer looks at them and sees an elaborate sunset of brilliant color and dimension and spirit and pricelessness. And yet, a stranger will pass that person and see a faceless member of the crowd, nothing more. We may hear rumors about a person and believe those things to be true. We may one day meet that person and feel foolish for believing baseless gossip.\n\nThis is the first generation that will be able to look back on their entire life story documented in pictures on the internet, and together we will all discover the after-effects of that. Ultimately, we post photos online to curate what strangers think of us. But then we wake up, look in the mirror at our faces and see the cracks and scars and blemishes, and cringe. We hope someday we'll meet someone who will see that same morning face and instead see their future, their partner, their forever. Someone who will still choose us even when they see all of the sides of the story, all the angles of the kaleidoscope that is you.\n\nThe point being, despite our need to simplify and generalize absolutely everyone and everything in this life, humans are intrinsically impossible to simplify. We are never just good or just bad. We are mosaics of our worst selves and our best selves, our deepest secrets and our favorite stories to tell at a dinner party, existing somewhere between our well-lit profile photo and our drivers license shot. We are all a mixture of our selfishness and generosity, loyalty and self-preservation, pragmatism and impulsiveness. I've been in the public eye since I was 15 years old. On the beautiful, lovely side of that, I've been so lucky to make music for living and look out into crowds of loving, vibrant people. On the other side of the coin, my mistakes have been used against me, my heartbreaks have been used as entertainment, and my songwriting has been trivialized as 'oversharing'.\n\nWhen this album comes out, gossip blogs will scour the lyrics for the men they can attribute to each song, as if the inspiration for music is as simple and basic as a paternity test. There will be slideshows of photos backing up each incorrect theory, because it's 2017 and if you didn't see a picture of it, it couldn't have happened right?\n\nLet me say it again, louder for those in the back...\n\nWe think we know someone, but the truth is that we only know the version of them that they have chosen to show us.\n\nThere will be no further explanation.\nThere will be just reputation.","3310416","Reputation [Prologue]","1177","Taylor Swift"
"[Verse 1]\nYou and I walk a fragile line\nI have known it all this time\nBut I never thought I'd live to see it break\nIt's getting dark and it's all too quiet\nAnd I can't trust anything now\nAnd it's coming over you like it's all a big mistake\n\n[Pre-Chorus]\nWhoa, holding my breath\nWon't lose you again\nSomething's made your eyes go cold\n\n[Chorus]\nCome on, come on, don't leave me like this\nI thought I had you figured out\nSomething's gone terribly wrong\nYou're all I wanted\nCome on, come on, don't leave me like this\nI thought I had you figured out\nCan't breathe whenever you're gone\nCan't turn back now, I'm haunted\n\n[Verse 2]\nStood there and watched you walk away\nFrom everything we had\nBut I still mean every word I said to you\nHe will try to take away my pain\nAnd he just might make me smile\nBut the whole time, I'm wishing it was you instead\n\n[Pre-Chorus]\nOh, holding my breath\nWon't see you again\nSomething keeps me holding onto nothing\n\n[Chorus]\nCome on, come on, don't leave me like this\nI thought I had you figured out\nSomething's gone terribly wrong\nYou're all I wanted\nCome on, come on, don't leave me like this\nI thought I had you figured out\nCan't breathe whenever you're gone\nCan't turn back now, I'm haunted\n\n[Bridge]\nI know\nI know\nI just know\nYou're not gone, you can't be gone, no\n\n[Chorus]\nCome on, come on, don't leave me like this\nI thought I had you figured out\nSomething's gone terribly wrong\nWon't finish what you started\nCome on, come on, don't leave me like this\nI thought I had you figured out\nCan't breathe whenever you're gone\nCan't go back, I'm haunted\n(Oh, oh, oh, oh, oh, oh, oh, oh, oh)\n\n[Outro]\nYou and I walk a fragile line\nI have known it all this time\nNever ever thought I'd see it break\nNever thought I'd see it","52592","Haunted","1177","Taylor Swift"
"[Verse 1]\nWish I had concentrated\nThey said love was complicated\nBut it's something I just fell into\nAnd it was overrated\nBut just look what I’ve created\nI came out alive but I’m black and blue\n\nBefore you ask me if I’m alright\nThink about what I\nHad to do, yeah\n\n[Chorus]\nWake up and smell the breakup\nFix my heart, put on my makeup\nAnother mess I didn't plan\nAnd I’ll bet, you thought you'd beat me\nWish you could only see\nI've got an ""I heart question mark""\nWritten on the back of my hand\n\n[Verse 2]\nI'd be fine if you just walked by\nBut you had to talk about why\nYou were wrong and I was right\nBut I can't believe you made me\nSit at home and cry like a baby\nWait right by the phone every night\nAnd now you ask about you and I\nThere's no you and I\nRemember what you put me through\nI had to\n\n[Chorus]\nWake up and smell the breakup\nFix my heart, put on my makeup\nAnother mess I didn't plan\nAnd I’ll bet, you thought you'd beat me\nWish you could only see\nI've got an ""I heart question mark""\nWritten on the back of my hand\n\n[Bridge]\nAnd when you're home alone at night\nYou'll still wonder\nWhy you took everything I had, oh baby\nI had a lot about you and I\nThere's no you and I\nAnd I know\nSomeday you will\n\n[Chorus]\nWake up and smell the breakup\nRealize that we won't make up\nIt didn't go the way you planned\nAnd you'll know you didn't beat me\nWhen you look down and see\nI've got an ""I heart question mark""\nWritten on the back of my hand\n\n[Outro]\nWritten on the back of my hand\nAn ""I heart question mark,"" yeah\nWritten on the back of my hand","187203","I Heart ?","1177","Taylor Swift"
"[Verse 1]\nAmerican boy, living life as it goes\nSitting on the fence posts\nLiving in the lie\nAmerican boy, living in the real world\nTrying just to get the girl\nTrying to survive\n\n[Chorus]\nThe simple things in life are always new\nGrowing up on Sam Hill avenue\nMama makes her cookies and daddy's just\nThe greatest living hero that ever was\nNothing in the world can ever once destroy\nThe hope of an American boy\n\n[Verse 2]\nLiving off of bar tips, trying for relationships\nLooking for the love\nSuddenly rise, an American beauty\nSuddenly he cheats, sent from above\n\n[Chorus]\nThe simple things in life are always new\nGrowing up on Sam Hill avenue\nMama makes her cookies and daddy's just\nThe greatest living hero that ever was\nNothing in the world can ever once destroy\nThe hope of an American boy\n\n[Verse 3]\nAmerican boy, raising little babies\nHearing daddy maybe, I'll be like you\nSuddenly life, seems just like a new dawn\nThat's grown up, American boy\n\n[Chorus]\nThe simple things in life are always new\nGrowing up on Grandview avenue\nMama makes her cookies and daddy's just\nThe greatest living hero that ever was\nNothing in the world will ever once destroy\nNo, nothing in the world will ever once destroy\nThe hope of an American boy","186996","American Boy","1177","Taylor Swift"
"[Intro]\nOh, oh, oh\nOh, oh, oh\nOh-oh, oh-oh\n\n[Verse 1]\nStand there like a ghost\nShaking from the rain, rain\nShe'll open up the door and say, ""Are you insane?""\nSay it's been a long six months\nAnd you were too afraid to tell her what you want, want\n\n[Pre-Chorus 1]\nAnd that's how it works\nThat's how you get the girl\nAnd then, you say\n\n[Chorus]\nI want you for worse or for better\nI would wait forever and ever\nBroke your heart, I'll put it back together\nI would wait forever and ever\nAnd that's how it works\nThat's how you get the girl, girl (oh-oh, oh)\nAnd that's how it works\nThat's how you get the girl, girl\n\n[Verse 2]\nRemind her how it used to be, be, yeah-yeah\nWith pictures in frames of kisses on cheeks, cheeks\nTell her how you must have lost your mind, ooh-ooh\nWhen you left her all alone\nAnd never told her why, why\n\n[Pre-Chorus 2]\nAnd that's how it works\nThat's how you lost the girl\nAnd now, you say\n\n[Chorus]\nI want you for worse or for better\nI would wait forever and ever (ever and ever)\nBroke your heart, I'll put it back together\nI would wait forever and ever\nAnd that's how it works\nThat's how you get the girl, girl (oh-oh, oh-oh)\nAnd that's how it works\nThat's how you get the girl, girl\nYeah, yeah\n\n[Bridge]\nAnd you know\nOh, oh, oh, oh, oh, oh, oh, oh, oh, oh\nThat I don't want you to go, oh, oh\n\n[Breakdown]\nRemind me how it used to be\nPictures in frames of kisses on cheeks\nAnd say you want me, yeah-yeah\nAnd then you say\n\n[Chorus]\n'Cause I want you for worse or for better (worse or for better)\nI would wait forever and ever (ever and ever)\nBroke your heart, I'll put it back together\nI would wait forever and ever (I want you forever and ever)\nAnd that's how it works\nThat's how you get the girl, girl (this is how it works)\nAnd that's how it works\nThat's how you get the girl, girl (get the girl)\n(That's how it works)\nAnd that's how it works\nThat's how you get the girl, girl\n(Oh, oh, oh, oh, oh, oh, oh, oh, oh, oh)\nAnd that's how it works\nThat's how you get the girl, girl\n(Oh, oh, oh, oh, oh, oh, oh, oh, oh, oh)\n\n[Outro]\nThat's how it works\nThat's how you got the girl","542383","How You Get the Girl","1177","Taylor Swift"
"If someone said three years from now\nYou'd be long gone\nI'd stand up and punch them out\nCause they're all wrong\nI know better, cause you said forever\nAnd ever, who knew?\n\nIf someone said three years from now\nYou'd be long gone\nThat last kiss, I'll cherish, until we meet again\nMy darling, who knew?\n\nBecause P!nk is from Philly, ladies and gentlemen!\n\nI wish I could tie you up in my shoes\nMake you feel unpretty too\nI was told I was beautiful\nBut what does that mean to you?\nLook into the mirror, who's inside there\nThe one with the long hair\nSame old me again today, yeah\n\nMy outsides look cool\nMy insides are blue\nEvery time I think I'm through\nIt's because of you\nI try different ways\nBut it's all the same\nAt the end of the day\nI have myself to blame\nI'm just trippin'\n\nYou can buy your hair if it won't grow\nYou can fix your nose if he says so\nYou can buy all the make-up\nThey can make, but if\nYou can't look inside you\nFind out who am I to\nBe in the position that make me feel\nSo\nOh, oh, oh, oh, oh\nOh, oh, oh, oh, oh\nMake you feel unpretty too\n\nThat's another song by an artist from Philly, I wanna see if you know it","3026441","Who Knew / Unpretty","1177","Taylor Swift"
"[Verse 1]\nHere I am, once again\nIn your driveway, thinking I should be leaving\nI should go but it's so entertaining watching you breathing\nYou went and got to me like\nThe stupid song on the radio that you try to forget\nBut it sticks in your head\nSo goodbye, it's not goodnight\nCause I'll be seeing you in my dreamin'\n\n[Chorus]\nBoy, you got me like a shot to the heart\nGot me shakin' so bad, spilled my coffee in the car\nCaught a red light I ran right through\nGotta call my friends, tell them all about you\nAlways looking like one of those nights\nWhen you're thinkin' 'bout kissing 'til the morning light\nYou got me, you do\n\n[Verse 2]\nIn a daze, pull the shades\nClose my eyes and picture you at my window\nI relax, I go back to all the things you said\nThat only I know\n\n[Chorus]\n\n\n[Bridge]\nI'm runnin' right out to my car\nAnd I pull out the drive\nIt's only been ten minutes\nBut I have to see you one more time\n\n[Chorus]","3021521","You Do","1177","Taylor Swift"
"[Verse 1]\nDo you remember\nThe 28th night of September?\nLove was changin' the minds of pretenders\nWhile chasin' the clouds away\nOur hearts were ringin'\nIn the key that our souls were singin'\nAs we danced in the night, remember\nHow the stars stole the night away\n\n[Chorus]\nAhh-ahh-ahh\nHey, say that you remember\nAi, ai, dancin' in September\nAi, ai, never was a cloudy day\n\n[Verse 2]\nMy thoughts are with you\nHolding hands with your heart to see you\nOnly blue talk and love\nRemember how we knew love was here to stay\nNow, December found the love that we shared in September\nOnly blue talk and love\nRemember the love that we share today\n\n[Chorus]\nAhh-ahh-ahh\nHey, say that you remember\nAi, ai, dancin' in September\nAi, ai, never was a cloudy day\nAhh-ahh-ahh\nHey, say that you remember\nAi, ai, dancin' in September\nAi, ai, golden dreams were shiny days\n\n[Bridge]\nDo you remember\nThe 28th night of September?\n\n[Chorus]\nAhh-ahh-ahh\nHey, say that you remember\nAi, ai, dancin' in September\nAi, ai, never was a cloudy day\nAhh-ahh-ahh\nHey, say that you remember\nAi, ai, dancin' in September\nAi, ai, golden dreams were shiny days\nAnd there never was a cloudy day\nThere never was a cloudy day","3646014","September","1177","Taylor Swift"
"[Verse 1]\nSeems the only one who doesn't see your beauty\nIs the face in the mirror looking back at you\nYou walk around here thinking you're not pretty\nBut that's not true, 'cause I know you\n\n[Chorus]\nHold on\nBaby you're losing it\nThe water's high\nYou're jumping into it\nAnd letting go\nAnd no one knows\nThat you cry\nBut you don't tell anyone\nThat you might\nNot be the golden one\nAnd you're tied together with a smile\nBut you're coming undone\n\n[Verse 2]\nI guess it's true that love was all you wanted\n'Cause you're giving it away like it's extra change\nHoping it will end up in his pocket\nBut he leaves you out like a penny in the rain\nOh, 'cause it's not his price to pay\nNot his price to pay\n\n[Chorus]\nHold on\nBaby you're losing it\nThe water's high\nYou're jumping into it\nAnd letting go\nAnd no one knows\nThat you cry\nBut you don't tell anyone\nThat you might\nNot be the golden one\nAnd you're tied together with a smile\nBut you're coming undone\nHold on\nBaby you're losing it\nThe water's high\nYou're jumping into it\nAnd letting go\nAnd no one knows\nThat you cry\nBut you don't tell anyone\nThat you might\nNot be the golden one\nAnd you're tied together with a smile\nBut you're coming undone\n\n[Outro]\nYou're tied together with a smile\nBut you're coming undone oh\nGoodbye, baby\nWith a smile, baby, baby","132092","Tied Together With A Smile","1177","Taylor Swift"
"[Verse-1]\nI could have keyed your car\nI could have rolled your yard\nI know the passwords to your emails and everything you do\nI could have put them to good use\n\nBut I'm dressed to kill\nAnd tonight I am going out on a date\nWith your best friend\nHe always liked me anyway\n\n[Hook]\nR.E.V.E.N.G.E\nMy list of things to do this week\nJealousy, misery\nGon' give you what you gave to me\nMake you feel so B.A.D\nBreak you, make you sorry\nI hope you cry, I'm getting my\nR.E.V.E.N.G.E\n\n[Verse-2]\nSo I'm gonna paint the town with him\nReplace your memory everywhere we've ever been\nI don't hang-out at smokey bars, but I know we'll see you there\nAnd I'll make you hear me laughing, like I just don't care\n\nI know you hate my friends, so tonight I called them all\nAnd later on you can expect some prank phone calls, baby!\n\n[Hook]\nR.E.V.E.N.G.E\nMy list of things to do this week\nJealousy, misery\nGon' give you what you gave to me\n\n[Interlude]\nS-A-N-I-T-Y\nI hope you lose yours tonight\nYou've made me crazy too long\nAnd so I'm working on\n\n[Hook]\nR.E.V.E.N.G.E\nMy list of things to do this week\nJealousy, misery\nGon' give you what you gave to me\n\n[Outro]\nBaby, baby\nR.E.V.E.N.G.E\nOh, and give you what you gave to me\nOh","474445","R.E.V.E.N.G.E.","1177","Taylor Swift"
"So this next clip is, uh, from a session that I had with Max Martin and Johan Shellback and what we like to do is we like to run, um, a recording on our phones of everything we're doing when we're putting a song together, just in case one of us blurts out a cool melody and then we forget about it, we want to go back and then-and replay the tape so that we can remind ourselves what exactly we were saying. Um, so I brought in this idea called ""Blank Space,"" and this was me playing it for Max and Johan for the first time and they're shouting out these production ideas like, you know the ""Oh!"" at the beginning of the chorus, um, and that ended up in the song. So, this is the very beginning stages of the song on the album called ""Blank Space.""\n\n""Nice to meet you, where you been?\nI could show you incredible things\nDiamonds, seasides, all those things\n[?] this song that [?]\nLike, oh my God, listen in\nListen in, I do too\n[?]\n[?] honest [?]\nWe can [?]\n[All you're?] thinking, all this time\n[?]\nOh my God, [?] me\nJust forget what you've heard about me\nDon't believe what you hear about me, hear about me\n'Cause it's gonna be forever, or gonna go -\nYeah! Hey, hey!\nGonna go down in flames\nYou can tell me when it's over -\nThis is like a, like an early 2000s Nelly track\nLong list of ex-love -\nGot a long list of ex-lovers, they'll tell you I'm insane\nBut I've got a blank space, baby\n*Click* I'll write your name\nI've got a blank space, baby\n*Click* I'll write your name""","556734","Blank Space (Voice Memo)","1177","Taylor Swift"
"[Verse 1]\nWalking downtown shuffling my feet\nI try to dream my dreams above the concrete\nStore windows, traveled for miles\nBut something I passed really caught my eye\nIt was cracked down the middle, permanent scars\nBut I fell in love with this here guitar\n\n[Chorus]\nNice to meet you, can I teach you\nAll I know, can you show me what you do\nWhere have you been\nWhat have you seen\nWho were you before you even knew me\nHave you been played for endless hours\nOr were you left in the corner\nOr were you someone's best friend\nThis here guitar\n\n[Verse 2]\nIt was my baby, anyone could see\nI love the cracks, the curves, the hidden beauty\nBut I can't help wondering why\nIt came to me and where we'll say goodbye\nThe cracks down the middle\nCan't see where they are\nSince I fell in love with this here guitar\n\n[Chorus]\nNice to meet you, can I teach you\nAll I know, can you show me what you do\nWhere have you been\nWhat have you seen\nWho were you before you even knew me\nHave you been played for endless hours\nOr were you left in the corner\nOr were you someone's best friend\nThis here guitar\n\n[Bridge]\nWere you a present from a father to a son?\nDid he forget you\nOr just play you 'til you came undone?\nHey, did some primadonna love you\n'Til she got her fame and fortune?\nI won't do that to you\n\n[Chorus]\nNice to meet you, can I teach you\nAll I know, can you show me what you do\nWhere have you been?\nWhat have you seen?\nWho were you before you even knew me?\nHave you been played for endless hours\nOr were you left in the corner\nOr were you someone's best friend?\nThis here guitar\nYou're my guitar\nThis here guitar","3021464","This Here Guitar","1177","Taylor Swift"
"[Verse 1]\nAny day now, they're talking war\nI can see the look that's in your eyes\nThey're not talking a week or two\nOh, daddy can I go with you?\nOh, daddy can I go with you?\n\n[Verse 2]\nYou pack a suitcase, take a picture from the wall\nI always knew this time would come\nWhen I ask how long you think you're going to be\nYou say, this crazy world's come undone\n\n[Verse 3]\nSummer's over and leaves begin to fall\nAnd another winter's on the way\nI knew I wasn't going to take this very well\nBut I'd give anything to have you here today\n\n[Verse 4]\nEveryday now they're talking war\n& I know this time is like it's never been before\nWe're not talking about a week or two\n\n[Outro]\nOh, daddy can I go with you?\nOh, daddy can I go with you?\nOh, daddy can I go with you?","187131","Can I Go With You","1177","Taylor Swift"
"[Verse 1]\nLet me know, how's it feel\nTo be under my skin, wrapped around my heart\nIs it like anywhere you've been?\nAnd everything I do, I do it just for you\n\n[Chorus]\nSo why the hell don't you love me?\nWhy the hell don't you need me like I need you?\nWhy you so far above me?\nDon't you know that there's nothing I wouldn't do?\nBut I was just a toy, which you destroyed\nStupid boy\n\n[Verse 2]\nI have been looking in, trying to read your mind\nGive you the benefit of the doubt, every single time\nAnd then you walk right by, I'm screaming out inside\n\n[Chorus]\nWhy the hell don't you love me?\nWhy the hell don't you need me like I need you?\nWhy you so far above me?\nDon't you know that there's nothing I wouldn't do?\nBut I was just a toy, which you destroyed\nStupid boy\n\n[Bridge]\nWhat happens when you wake up, to see that you've lost?\nYou take one look at me, cause that's what it cost\nI just wanna be everything you need\nCause you're everything to me\n\n[Chorus]\nSo why the hell don't you love me?\nWhy the hell don't you need me like I need you?\nWhy you so far above me?\nDon't you know that there's nothing I wouldn't do?\nBut I was just a toy, which you destroyed\nStupid boy\n\n[Outro]\nLet me know, how's it feel to be under my skin","187436","Stupid Boy","1177","Taylor Swift"
"[Verse 1]\nAll this time I was wasting hoping you would come around\nI've been giving out chances every time and all you do is let me down\nAnd it's taken me this long baby but I've figured you out\nAnd you're thinking we'll be fine again but not this time around\n\n[Hook]\nYou don't have to call anymore\nI won't pick up the phone\nThis is the last straw\nDon't wanna hurt anymore\nAnd you can tell me that you're sorry\nBut I don't believe you baby like I did before\nYou're not sorry (No no no no)\n\n[Verse 2]\nYou're looking so innocent\nI might believe you if I didn't know\nCould've loved you all my life if you hadn't left me waiting in the cold\nAnd you've got your share of secrets\nAnd I'm tired of being last to know\nAnd now you're asking me to listen 'cause it's worked each time before but\n\n[Hook]\nYou don't have to call anymore\nI won't pick up the phone\nThis is the last straw\nDon't wanna hurt anymore\nAnd you can tell me that you're sorry\nBut I don't believe you baby like I did before\nYou're not sorry (No no no no)\nYou're not sorry (No no no no)\n\n[Bridge]\nYou had me crawling for you honey and it never would have gone away\nYou used to shine so bright but I watched all of it fade so\n\n[Hook]\nYou don't have to call anymore\nI won't pick up the phone\nThis is the last straw\nThere's nothing left to beg for\nAnd you can tell me that you're sorry\nBut I don't believe you baby like I did before\nYou're not sorry (No no no no)\nYou're not sorry (No no no no)\n(No, no, no...)","57418","You're Not Sorry","1177","Taylor Swift"
"[Verse 1]\nHe is sensible and so incredible\nAnd all my single friends are jealous\nHe says everything I need to hear and it's like\nI couldn't ask for anything better\nHe opens up my door and I get into his car\nAnd he says you look beautiful tonight\nAnd I feel perfectly fine\n\n[Chorus]\nBut I miss screaming and fighting and kissing in the rain\nAnd it's 2am and I'm cursing your name\nYou're so in love that you act insane\nAnd that's the way I loved you\nBreaking down and coming undone\nIt's a roller coaster kind of rush\nAnd I never knew I could feel that much\nAnd that's the way I loved you\n\n[Verse 2]\nHe respects my space\nAnd never makes me wait\nAnd he calls exactly when he says he will\nHe's close to my mother\nTalks business with my father\nHe's charming and endearing\nAnd I'm comfortable\n\n[Chorus]\nI miss screaming and fighting and kissing in the rain\nIt's 2am and I'm cursing your name\nI'm so in love that I acted insane\nAnd that's the way I loved you\nBreaking down and coming undone\nIt's a roller coaster kind of rush\nAnd I never knew I could feel that much\nAnd that's the way I loved you\n\n[Verse 3]\nHe can't see the smile I'm faking\nAnd my heart's not breaking\n'Cause I'm not feeling anything at all\nAnd you were wild and crazy\nJust so frustrating intoxicating\nComplicated, got away by some mistake and now\n\n[Chorus]\nI miss screaming and fighting and kissing in the rain\nIt's 2am and I'm cursing your name\nI'm so in love that I acted insane\nAnd that's the way I loved you\nBreaking down and coming undone\nIt's a roller coaster kind of rush\nAnd I never knew I could feel that much\nAnd that's the way I loved you oh, oh\n\n[Outro]\nAnd that's the way I loved you oh, oh\nNever knew I could feel that much\nAnd that's the way I loved you","124511","The Way I Loved You","1177","Taylor Swift"
