"line","song_id","song_name","artist_id","artist_name"
"[Verse 1]\nI can't believe you did it again\nWalked by and took my heart with you\nWhy did you have to look so good?\nDon't you know that I'm trying to hate you\nTrying to have a dream without you in it\nBut how can I put out this fire\nWhen you're the one who lit it\n\n[Chorus]\nI can't wait for the day I stop pretending\nThat I'm really OK when I'm not\nI want to know how it feels to be\nOver you for real\nUntil I do\nI'll keep writing songs about you\n\n[Verse 2]\nI've got a stack of papers so high\nAnd it's all about you baby\nKeep thinking maybe I\nCan make sense of something crazy\nSomething I can't get out of my Head\nI write your name I write your name\nThen I tear it all to shreds\n\n[Chorus]\n\n[Verse 3]\nAnd if you ever change your mind\nAnd want me back again\nI hope these songs will remind me\nWhy I shouldn't let you in\n\n[Chorus]\nI can't wait for the day I stop pretending\nThat I'm really OK cause I'm not\nI want to know how it feels to be\nOver you for real\nUntil I do\n\n[Chorus]\nI'll just wait for the day\nI stop pretending\nThat I'm really OK when I'm not\nI want to know how it feels to be over you for real\nTill I do\nI'll keep writing songs about you","187448","Writing Songs About You","1177","Taylor Swift"
"[Enchanted]\nThis night is sparkling, don't you let it go\nI'm wonderstruck, blushing all the way home\nI'll spend forever wondering if you knew\nThat this night is flawless, don't you let it go\nI'm wonderstruck, dancing around all alone\nI'll spend forever wondering if you knew\nI was enchanted to meet you\n\n[Wildest Dreams]\nHe said let's get out of this town\nDrive out of the city, away from the crowds\nI thought heaven can't help me now\nNothing lasts forever, but this is gonna take me down\nHe's so tall and handsome as hell\nHe's so bad but he does it so well\nI can see the end as it begins\nMy one condition is\nSay you'll remember me\nStanding in a nice dress, staring at the sunset, babe\nRed lips and rosy cheeks\nSay you'll see me again even if it's just in your\nWildest dreams (ah ah)\nWildest dreams (ah ah)\nHe said no one has to know what we do\nHis hands are in my hair, his clothes are in my room\nAnd his voice is a familiar sound\nNothing lasts forever\nBut this is getting good now\nHe's so tall and handsome as hell\nHe's so bad but he does it so well\nAnd when we've had our very last kiss\nMy last request is\nSay you'll remember me\nStanding in a nice dress, staring at the sunset, babe\nRed lips and rosy cheeks\nSay you'll see me again even if it's just in your\nWildest dreams (ah ah)\nWildest dreams (ah ah)\n\nOoh\n\n[Enchanted]\nThis night is sparkling\nDon't you let it go, don't you let it go\nThis night is flawless\nDon't you let it go, don't you let it go\nThis night is sparkling\nDon't you let it go, don't you let it go\nThis night is flawless\nDon't you let it go\n\n[Wildest Dreams]\nYou'll see me in hindsight, tangled up with you all night\nBurning it down\nSomeday when you leave me\nI bet these memories follow you around\nYou'll see me in hindsight, tangled up with you all night\nBurning it down\nSomeday when you leave me\nI bet these memories follow you around\nYou'll see me in hindsight, tangled up with you all night\nBurning it down\nSomeday when you leave me\nI bet these memories follow you around\nYou'll see me in hindsight, tangled up with you all night\nBurning it down\nSomeday when you leave me\nI bet these memories follow you around (follow you around)\nSay you'll remember me\nStanding in a nice dress, staring at the sunset, babe\nRed lips and rosy cheeks\nSay you'll see me again, even if it's just pretend\nSay you'll remember me\nStanding in a nice dress, staring at the sunset, babe\nRed lips and rosy cheeks\nSay you'll see me again even if it's just in your\nWildest dreams (ah ah)\nWildest dreams (ah ah)\n(Even if it's just in your)\nWildest dreams (ah ah)\nWildest dreams (ah ah)\n\n[Enchanted]\nThis night is sparkling\nDon't you let it go, don't you let it go\nThis night is flawless\nDon't you let it go, don't you let it go\nThis night is sparkling\nDon't you let it go, don't you let it go\nThis night is flawless\nDon't you let it go\n\nIn your\n\n[Wildest Dreams]\nWildest dreams (ah ah)\nWildest dreams (ah ah)\nEven if it's just in your\nWildest dreams (ah ah)\nWildest dreams (ah ah)","2324781","Wildest Dreams / Enchanted","1177","Taylor Swift"
"I'm curled up in my mother's bed, staring intently at my laptop. I'm watching a video of a familiar-looking man wearing a black tuxedo. The video seems to be of a televised award show. The tape is grainy, but the man steps up to the mic and his words are clear:\n\n""Now I'm gonna deal you a queen from the winning hand. Her voice is full like solid gold, with some platinum blended in. Sometimes you'll hear silver when she twists and twirls her notes... but gold is Brenda's metal in this song I wish I'd wrote. Ladies and gentlemen... Brenda Lee.""\n\nThe camera then focuses on a woman in her late thirties. The music starts, and she's looking down at a framed picture. She's at ease. She is theatrical. And she is beautiful, in a sparkling gown that matches the twinkle in her eye. Lights, camera, action. She starts to sing. That's when you hear the gold, and you watch her as she holds the crowd in the palm of her hand. The performance ends, and the crowd goes wild. The lovely lady graciously takes a bow. She smiles out into the vast darkness, taking it all in with grace and composure. The video ends, and I reflect back on what I just saw. It was a timeless performance, but here are the facts: The year is 1983. The song is ""Someone Loves You Honey."" The man in the tuxedo is Johnny Cash. And the woman in the beautiful dress with the honey-like voice is none other than Brenda Lee.\n\nBrenda Lee, who was born in 1944 near Atlanta and used her prodigious singing talent to support her family after the tragic death of her father. Brenda Lee, the little girl who took over the music world with chart-topping hits when she was still a child. Brenda Lee, the woman who ushered in a new style of rock & roll and was one of the early musical artists to find her fame through television. Brenda Lee, the artist who later went back to her country roots, proving that she could create classics and break down barriers no matter what genre or category her music fell under. Brenda Lee, the singer who mastered the sound of heartbreak so flawlessly that she made audiences not only identify with her but believe her.\n\nI watch the look on her face as she ends her song and first hears that applause. There's a reason she's been able to move people to their feet for almost sixty years. Brenda Lee is grace. Brenda Lee is class and composure. And when she hears the roar of a crowd, Brenda Lee smiles like she's five years old and receiving her first standing ovation. Brenda Lee is someone I will always look up to because of the way she shines. As Johnny Cash said in 1983, it's almost like she's golden.","3284327","Rare Peer (Brenda Lee Tribute)","1177","Taylor Swift"
"[Verse 1]\nYour beautiful eyes\nStare right into my eyes\nAnd sometimes I think of you late at night\nI don't know why\nI wanna be somewhere where you are\nI wanna be where\n\n[Chorus]\nYou're here, your eyes are looking into mine\nSo baby, make me fly\nMy heart has never felt this way before\nI'm looking through your\nI'm looking through your eyes\n\n[Verse 2]\nI wake up, I'm alive\nIn only a little while I'll cry\nCause you're my lullaby\nSo baby come hold me tight cause I-I\nI wanna be everything you need\nI wanna be where\n\n[Chorus]\nYou're here, your eyes are looking into mine\nSo baby, make me fly\nMy heart has never felt this way before\nI'm looking through your\nI'm looking through your eyes\n\n[Outro]\nJust as long as you're mine\nI'll be your everything tonight\nLet me love you, kiss you\nOh, baby, let me miss you\nLet me see your\nDream about, dream about\nDream about your eyes\nEyes, eyes\nBeautiful eyes","187017","Beautiful Eyes","1177","Taylor Swift"
"1. ""New Romantics""\n2. ""22""\n3. ""Blank Space""\n4. ""Style""\n5. ""Fifteen""\n6. ""You Belong With Me""\n7. ""Holy Ground""\n8. ""We Are Never Ever Getting Back Together"" / ""Bad Blood\n9. ""Love Story""\n10. ""This Is What You Came For""\n11. ""Sparks Fly""\n12. ""Wildest Dreams/Enchanted""\n13. ""Out Of The Woods""\n14. ""Shake It Off""","2889869","Formula 1 2016 Setlist","1177","Taylor Swift"
"NA","3947020","Scream","1177","Taylor Swift"
"[Verse 1]\nI'm dreaming of a white Christmas\nJust like the ones I used to know\nWhere the tree tops glisten and children listen\nTo hear sleigh bells in the snow\n\n[Verse 2]\nI'm dreaming of a white Christmas\nWith every Christmas card I write\nMay your days be merry and bright\nAnd may all your Christmases be white\n\n[Intermission]\n\n[Verse 3]\nI'm dreaming of a white Christmas\nJust like the ones I used to know\nSo may your days be merry and bright\nAnd may all your Christmases be white\n\n[Outro]\nMay your days be merry and bright\nAnd may all your Christmases be white","186870","White Christmas","1177","Taylor Swift"
"[Verse 1]\nPut your lips close to mine\nAs long as they don’t touch\nOut of focus, eye to eye\nTill the gravity’s too much\nAnd I’ll do anything you say\nIf you say it with your hands\nAnd I’d be smart to walk away\nBut you’re quicksand\n\n[Chorus]\nThis slope is treacherous\nThis path is reckless\nThis slope is treacherous\nAnd I, I, I, like it\n\n[Verse 2]\nI can’t decide if it’s a choice\nGetting swept away\nI hear the sound of my own voice\nAsking you to stay\nAnd all we are is skin and bone\nTrained to get along\nForever going with the flow\nBut you’re friction\n\n[Chorus]\nThis slope is treacherous\nThis path is reckless\nThis slope is treacherous\nI, I, I, like it\n\n[Bridge]\nTwo headlights shine through the sleepless night\nAnd I will get you, get you alone\nYour name has echoed through my mind\nAnd I just think you should\nThink you should know\nThat nothing safe is worth the drive\nAnd I would follow you, follow you home\nI’ll follow you, follow you home\n\n[Chorus]\nThis hope is treacherous\nThis daydream is dangerous\nThis hope is treacherous\nI, I, I\nI, I, I\nI, I, I\n\n[Breakdown]\nTwo headlights shine through the sleepless night\nAnd I will get you, get you alone\nYour name has echoed through my mind\nAnd I just think you should\nThink you should know\nThat nothing safe is worth the drive\nAnd I would follow you, follow you home\nI’ll follow you, follow you home\nI’ll follow you, follow you home\nI’ll follow you, follow you home\nI’ll follow you, follow you home\n\n[Outro]\nThis slope is treacherous\nI, I, I, like it","1983447","Treacherous (Original Demo Recording)","1177","Taylor Swift"
"[Verse 1]\nShe's looking in the mirror\nThe moment's getting nearer\nShe thinks about it as she walks her walk\nUp and down the staircase\nMake up fresh on her face\nShe thinks about it as she talks her talk\n\n[Verse 2]\nSchool dance, first chance\nAlways been a dreamer\nThere's one guy, she's shy\nSees him through the mirror\nAnd everybody looks at her\nShe thinks about it\nBlue dress, angel face\nLooking in the mirror\nShoes, purse, hair tied back\nAnd you should see her\nShe's got her magic\nFloating through the air\n\n[Chorus]\nPeace, love\nOne thing leads into another\nDream big, aim small\nMan you got to love her\nShe's got her hopes up\nGot them up to there\nWondering what to wear\n\n[Verse 4]\nShe's standing in her bedroom\nHe'll be pulling up soon\nShe thinks about it when she sees headlights\nLooking out the window\nShe's got her diary to show\nThat she's been waiting for this all her life\nFirst date, can't wait\nLooking in the mirror\nHeart all wrapped up\nWait until he sees her\nHe's looking right at her\nShe thinks about it\nSixteen blue jeans, Abercrombie T-shirt\nShoes, purse, hair tied back\nAnd you should see her\nShe's got her magic\nFloating through the air\n\n[Chorus]\n\n[Bridge]\nThe years went by\nThe mirror saw her cry\nShe got up again\nShe got up again\nThe wind blew by\nThe small town lights\nShe got up again\nMove out, find out\nWhere the world can take her\nBright lights, late nights\nLiving for the greater\nMove to Paris\nLiving on a prayer\n\n[Chorus]\nPeace, love\nOne thing leads into another\nDream big, aim small\nMan you got to love her\nShe's got her hopes up\nGot them up to there\nShe's got her hopes up\nGot them up to there\nWondering what to wear\n\n[Outro]\nOh, oh, oh\nWondering what to wear","187447","What To Wear","1177","Taylor Swift"
"I need you now\nRead letters that i wrote on the wall\nAnd the message that i left on my car\nI need you now\nWords that said drowned out by the rain\nWaiting there for you but you never came\nMy world's a little colder now\nBut i'm keeping warm somehow\n\nSo here you are at my window\nGuess nobody told you\nI don't need you, don't need you\nAnd i waited so frustrated\nWho's gonna hold you\nI don't need you, don't need you now\n\nI need you now\nWords i heard you whispered to me\nAnd we will walk you down a one-way street\nYou need me now\nThat's what you've been telling my friends\nBut i'd come too far to go back there again\nMy heart, my mind, my mother's a chain\nYour mind as well forget my name\n\nSo here you are at my window\nGuess nobody told you\nI don't need you, don't need you\nAnd i waited so frustrated\nWho's gonna hold you\nI don't need you, don't need you now\n\nI need you now\nRead letters that i wrote on the wall\nAnd the message that i left on my car\n\nSo here you are at my window\nGuess nobody told you\nI don't need you, don't need you\nAnd i waited so frustrated\nWho's gonna hold you\nI don't need you now\n\nAnd i'm not what you want\nI won't wonder where you are\nI won't dream a thousand stars\nI don't need you now\nI don't need you by the rain\nAnd i never heard you say\nI need you, i need you\nI don't need you now\nDon't need you\nI don't need you now","711148","Need You Now","1177","Taylor Swift"
"[Verse 1]\nMe and Britney used to sit on the front porch drinking lemonade\nTalking about things no one else was ever supposed to hear\nIn the summer shade\nShe said she was gonna be a movie star\nAnd I said she was crazy\nCatching dreams and fireflies in a jar\nJust me and Britney\n\n[Chorus]\nOh, oh\nWe were babies, we were beautiful and free\nOh, oh\nThere was nothing that was out of reach\nFor me and Britney\n\n[Verse 2]\nShe never made it to Hollywood but she made it to Memphis\nAnd this little old town just hasn’t been the same since\nThat boy she went ran off with, well, I thought he was crazy\nMaybe I was just jealous that he'd come between me and Britney\n\n[Chorus]\nOh, oh\nShe was in love, she was beautiful and free\nOh, oh\nShe was always so much braver than me\n\n[Bridge]\nWhen the phone rang in the middle of the night\nBefore she said a word I knew it was her\nShe said I’m sorry for waking you up but I didn’t know who else to call\nOr where else to go\n\n[Verse 3]\nMe and Britney sat down on the front porch\nTalking about love and how it changes things\nChanges people and it changes names and everything but me and Britney\n\n[Chorus]\nOh, oh\nWe’re not as young, but we’re still beautiful and free\nOh, oh\nEven when we’re old, we’re still going to be\n\n[Outro]\nMe and Britney sitting on the front porch drinking lemonade\nTalking about things no one else was ever gonna hear\nIn the summer shade","2466710","Me and Britney","1177","Taylor Swift"
"[Chorus]\nLast Christmas I gave you my heart\nBut the very next day, you gave it away\nThis year, to save me from tears\nI will give it to someone special\n\n[Verse 1]\nOnce bitten and twice shied\nI keep my distance but you still catch my eye\nTell me baby\nDo you recognize me\nWell, it has been a year, it does not surprise me\nMerry Christmas, I wrapped it up and sent it\nWith a note saying 'I love you', I meant it\nNow I know what a fool I've been\nBut if you kiss me now, I know you would fool me again\n\n[Chorus]\nLast Christmas I gave you my heart\nBut the very next day, you gave it away\nThis year, to save me from tears\nI will give it to someone special\nLast Christmas I gave you my heart\nBut the very next day, you gave it away\nThis year, to save me from tears\nI will give it to someone special\n\n[Verse 2]\nA crowded room and friends with tired eyes\nI am hiding from you and your soul of ice\nMy God, I thought you were someone to rely on\nMe, I guess I was a shoulder to cry on\nA face on a lover with a fire in his heart\nA girl on a cover but you tore her apart\nMaybe this year\nMaybe this year I will give it to someone special\n\n[Chorus]\nBecause last Christmas I gave you my heart\nBut the very next day, you gave it away\nThis year, to save me from tears\nI will give it to someone special\nLast Christmas I gave you my heart\nBut the very next day, you gave it away\nThis year, to save me from tears\nI will give it to someone special\n\n\nAnd last Christmas\nAnd this year\nIt won't be anything like, anything like\n\nLast Christmas I gave you my heart\nBut the very next day, you gave it away\nThis year, to save me from tears\nI will give it to someone special","186824","Last Christmas","1177","Taylor Swift"
"[Verse 1]\nI live down the street in a broken down house\nAnd a car up on blocks in the driveway\nThe moment we meet, there was never a doubt\nThat we won't forget this Sunday\nIt starts with a smile, and we walk a few miles\nAnd it all leads to this - our first kiss\n\n[Chorus]\nAll my friends are saying\nGirl, what are you thinking?\nYou're better off\nYou're better off without him\nFind yourself another\nGirl, that boy is trouble\nYou're better off, you're better off\nThey can talk forever, they just don't know better\n\n[Verse 2]\nWe drive around town in a rusty old truck\nSomehow it feels like we're flying\nDon't want to come down\nBut they make it so tough\nCause everyone we know is trying\nTo push us apart hide it down in our hearts\nAnd they get what they want cause you're gone\n\n[Chorus]\nAll my friends are saying\nGirl, why are you crying?\nYou're better off, you're better off without him\nFind yourself another\nGirl, that boy is trouble\nYou're better off, you're better off\nThey can talk forever, they just don't know better\n\n[Verse 3]\nYou come to my door\nIn the pouring rain\nWe know what we don't have to say\nYou hand me a rose and a note that says\nWe don't have to do things their way\n\n[Chorus]\nAll my friends are saying\nGirl, what are you thinking?\nYou're better off, you're better off without him\nFind yourself another\nGirl, that boy is trouble\nYou're better off, you're better off\nWell, they can talk forever, they just don't know better","187085","Better Off","1177","Taylor Swift"
"You don't have to call me\nAnd say you're sorry\nI'm already gone\n\nYou don't have to call me\nAnd break my heart\nEach time i try movin on, oh\n\nYou don't have to call, Anymore\nOh, Yeah\nYou don't have to call baby\n\nYou don't have to call me\nAnd say you're sorry\nI'm already gone\n\nYou don't have to call me\nAnd break my heart\nEach time i try movin on, oh\n\nYou don't have to call, Anymore\nOh, Yeah\nYou don't have to call baby\n\nYou don't have to call me\nAnd say you're sorry\nI'm already gone\n\nYou don't have to call me\nAnd break my heart\nEach time i try movin on, oh\n\nYou don't have to call, Anymore\nOh, Yeah\nYou don't have to call baby","321493","You Don't Have To Call  Me","1177","Taylor Swift"
"There's a plane or a bus leaving Dallas\nI hope you're on it\nIf there's a train moving fast down the tracks\nI hope you caught it\n'Cause I swear out there ain't where\nYou outta be\nSo catch a ride or catch a cab\nDon't you know that I miss you bad\nBut don't you walk to me\n\nBaby run cut a path across the blue sky\nStraight in a straight line\nYou can't get here fast enough\nFind a truck and fire it up\nLean on the gas and off the clutch\nLeave Dallas in the dust\nI need you in a rush\nSo baby run\nSo baby run\n\nOh if you ain't got a suitcase\nGet a box\nOr an old brown paper sack\nPack it light or pack it heavy\nTake a truck, take a Chevy\nBaby just come back\nThere's a shortcut to the highway out of town\nWhy don't you take it\nDon't let that speed limit slow you down\nGo on and break it\nBaby break it\n\nBaby run\nCut a path across the blue sky\nStraight in a straight line\nYou can't get here fast enough\nFind a truck and fire it up\nLean on the gas and off the clutch\nLeave Dallas in the dust\nI need you in a rush\nSo baby run\n\nRun to me\nBaby run\nRun to me\nSo baby run\nRun\nOh baby run","2940844","Run","1177","Taylor Swift"
"Lyrics available upon release. Stay tuned!","3122591","Had Nothing But a Time We Never Had*","1177","Taylor Swift"
"[Verse 1: Clean]\n\nThe drought was the very worst\nOh-oh, oh-oh\nWhen the flowers that we'd grown together died of thirst\nIt was months and months of back and forth\nOh-oh, oh-oh\n\n[Pre-Chorus: Clean]\nHung my head as I lost the war\nAnd the sky turned black like a perfect storm\n\n[Chorus: Clean]\nRain came pouring down\nWhen I was drowning, that's when I could finally breathe\nAnd by morning\nGone was any trace of you, I think I am finally clean\nI think I am finally clean\n\n[Verse 1: Long Live]\nI said remember this moment, in the back of my mind\nThe time we stood with our shaking hands\nThe crowds in the stands went wild\nWe were the Kings and the Queens\nAnd they read off our names\nThe night you danced like you knew our lives\nWould never be the same\nYou held your head like a hero\nOn a history book page\nIt was the end of a decade\nBut the start of an age\n\n[Chorus: Long Live]\nLong live the walls we crashed through\nAll the kingdom lights shined just for me and you\nI was screaming long live all the magic we made\nAnd bring on all the pretenders\nOne day, we will be remembered\nLong live all the mountains we moved\nI had the time of my life fighting dragons with you\nI was screaming long live that look on your face\nAnd bring on all the pretenders\nOne day, we will be remembered\n\n[Bridge: Long Live]\nHold on to spinning around\nConfetti falls to the ground\nMay these memories break our fall\n\n[Transition: New Year's Day]\n\nAnd hold on...\nTo spinning around...\nConfetti...\nFalls to the ground...\n\n[Verse 1: New Year's Day]\nThere's glitter on the floor after the party\nGirls carrying their shoes down in the lobby\nCandle wax and Polaroids on the hardwood floor\nYou and me from the night before, but\n\n[Chorus: New Year's Day]\nDon't read the last page\nBut I stay when you're lost, and I'm scared\nAnd you're turning away\nI want your midnights\nBut I'll be cleaning up bottles with you on New Year's Day\n\n[Verse 2: New Year's Day]\nYou squeeze my hand three times in the back of the taxi\nI can tell that it's gonna be a long road\nI'll be there if you're the toast of the town, babe\nOr if you strike out and you're crawling home\n\n[Chorus: New Year's Day]\nDon't read the last page\nBut I stay when it's hard, or it's wrong\nOr we're making mistakes\nI want your midnights\nBut I'll be cleaning up bottles with you on New Year's Day\n\n[Post-Chorus: New Year's Day]\nHold on to the memories, they will hold on to you\nHold on to the memories, they will hold on to you\nHold on to the memories, they will hold on to you\nAnd I will hold on to you\n\n[Bridge: New Year's Day]\nPlease don't ever become a stranger\nWhose laugh I could recognize anywhere\nPlease don't ever become a stranger\nWhose laugh I could recognize anywhere\n\n[Verse 3: New Year's Day]\nThere's glitter on the floor after the party\nGirls carrying their shoes down in the lobby\nCandle wax and Polaroids on the hardwood floor\nYou and me from the night before, but\n\n[Chorus: New Year's Day]\nDon't read the last page\nBut I stay when it's hard, or it's wrong\nOr we're making mistakes\nI want your midnights\nBut I'll be cleaning up bottles with you on New Year's Day\n\n[Post-Chorus: New Year's Day]\nHold on to the memories, they will hold on to you\nHold on to the memories, they will hold on to you\nHold on to the memories, they will hold on to you\n\n[Transition: Long Live]\nAnd Long live\n(Please don't ever become a stranger)\nThe walls we crashed through\n(Whose laugh I could recognize anywhere)\nI had the time of my life\n(Please don't ever become a stranger)\nWith you\n(Whose laugh I could recognize anywhere)\n\n[Outro: Long Live]\nAnd Long live\nThe walls we crashed through\nI had the time of my life\nWith you","4170714","Clean/Long Live/New Year's Day","1177","Taylor Swift"
