"line","song_id","song_name","artist_id","artist_name"
"[Verse 1]\nDrew looks at me\nI fake a smile so he won't see\nThat I want and I'm needing\nEverything that we should be\n\n[Pre-Chorus 1]\nI'll bet she's beautiful, that girl he talks about\nAnd she's got everything that I have to live without\n\n[Verse 2]\nDrew talks to me\nI laugh 'cause it's so damn funny\nThat I can't even see\nAnyone when he's with me\n\n[Pre-Chorus 2]\nHe says he's so in love, he's finally got it right\nI wonder if he knows he's all I think about at night\n\n[Chorus]\nHe's the reason for the teardrops on my guitar\nThe only thing that keeps me wishing on a wishing star\nHe's the song in the car\nI keep singing, don't know why I do...\n\n[Verse 3]\nDrew walks by me\nCan't he tell that I can't breathe?\nAnd there he goes, so perfectly\nThe kind of flawless I wish I could be\n\n[Pre-Chorus 3]\nShe'd better hold him tight, give him all her love\nLook in those beautiful eyes and know she's lucky 'cause\n\n[Chorus]\nHe's the reason for the teardrops on my guitar\nThe only thing that keeps me wishing on a wishing star\nHe's the song in the car\nI keep singing, don't know why I do...\n\n[Bridge]\nSo I drive home alone, as I turn off the light\nI'll put his picture down and maybe get some sleep tonight\n\n[Chorus]\nHe's the reason for the teardrops on my guitar\nThe only one who’s got enough of me to break my heart\nHe's the song in the car\nI keep singing, don't know why I do...\n\n[Outro]\nHe's the time taken up, but there's never enough\nAnd he's all that I need to fall into\nDrew looks at me\nI fake a smile so he won't see","57189","Teardrops On My Guitar","1177","Taylor Swift"
"[Chorus]\nSanta baby, slip a sable under the tree, for me\nI have been an awful good girl, Santa baby\nSo hurry down the chimney tonight\n\n[Chorus]\nSanta baby, a '54 convertible, too, light blue\nWell I will wait up for you, dear, Santa baby\nSo hurry down the chimney tonight, yeah\n\n[Verse 1]\nThink of all the fun I have missed\nThink of all the boys I have not kissed\nNext year I could be just as good\nIf you check off my Christmas list\n\n[Chorus]\nSanta baby, I want a yacht and really that is not a lot\nI have been an angel all year, Santa baby\nSo hurry down the chimney tonight\n\n[Chorus]\nSanta, honey, there is one more thing I really do need, the deed\nTo a platinum mine, Santa honey\nSo hurry down the chimney tonight\n\n[Verse 2]\nCome and trim my Christmas tree\nWith some decorations bought at Tiffany's\nI really do believe in you\nLet us see if you believe in me\n\n[Chorus]\nSanta baby, forgot to mention one little thing\nA ring\nAnd I do not mean on the phone, Santa baby\nSo hurry down the chimney tonight","186846","Santa Baby","1177","Taylor Swift"
"[Intro]\nI am not the kind of girl\nWho should be rudely barging in\nOn a white veil occasion\nBut you are not the kind of boy\nWho should be marrying the wrong girl\n\n[Verse 1]\nI sneak in and see your friends\nAnd her snotty little family\nAll dressed in pastel\nAnd she is yelling at a bridesmaid\nSomewhere back inside a room\nWearing a gown shaped like a pastry\n\n[Pre-Chorus]\nThis is surely not\nWhat you thought it would be\nI lose myself in a daydream\nWhere I stand and say\n\n[Chorus]\nDon't say yes, run away now\nI'll meet you when you're out\nOf the church at the back door\nDon't wait or say a single vow\nYou need to hear me out\nAnd they said ""speak now""\n\n[Verse 2]\nFond gestures are exchanged\nAnd the organ starts to play\nA song that sounds like a death march\nAnd I am hiding in the curtains\nIt seems that I was uninvited\nBy your lovely bride-to-be\n\n[Pre-Chorus]\nShe floats down the aisle\nLike a pageant queen\nBut I know you wish it was me\nYou wish it was me (Don't you)\n\n[Chorus]\nDon't say yes, run away now\nI'll meet you when you're out\nOf the church at the back door\nDon't wait or say a single vow\nYou need to hear me out\nAnd they said ""speak now""\n\n[Chorus]\nDon't say yes, run away now\nI'll meet you when you're out\nOf the church at the back door\nDon't wait or say a single vow\nYour time is running out\nAnd they said ""speak now""\n\n[Interlude]\nOoh, la-da-da-da, oh\nOoh, ooh\n(Say a single vow)\n\n[Bridge]\nI hear the preacher say\n""Speak now or forever hold your peace""\nThere's the silence, there's my last chance\nI stand up with shaking hands, all eyes on me\nHorrified looks from everyone in the room\nBut I'm only looking at you\n\n[Verse 3]\nI am not the kind of girl\nWho should be rudely barging in\nOn a white veil occasion\nBut you are not the kind of boy\nWho should be marrying the wrong girl\n(Hehe!)\n\n[Chorus]\nDon't say yes, run away now\nI'll meet you when you're out\nOf the church at the back door\nDon't wait or say a single vow\nYou need to hear me out\nAnd they said ""speak now""\n\n[Chorus - Variation]\nAnd you say\n""Let's run away now\nI'll meet you when\nI'm out of my tux at the back door""\nBaby, I didn't say my vows\nSo glad you were around when they said\n""Speak now""","50968","Speak Now","1177","Taylor Swift"
"[Verse 1]\nPut your lips close to mine\nAs long as they don't touch\nOut of focus, eye to eye\n'Til the gravity's too much\nAnd I'll do anything you say\nIf you say it with your hands\nAnd I'd be smart to walk away\nBut you're quicksand\n\n[Chorus 1]\nThis slope is treacherous\nThis path is reckless\nThis slope is treacherous\nAnd I-I-I like it\n\n[Verse 2]\nI can't decide if it's a choice\nGetting swept away\nI hear the sound of my own voice\nAsking you to stay\nAnd all we are is skin and bone\nTrained to get along\nForever going with the flow\nBut you're friction\n\n[Chorus 1]\nThis slope is treacherous\nThis path is reckless\nThis slope is treacherous\nAnd I, I, I like it\n\n[Bridge]\nTwo headlights shine through the sleepless night\nAnd I will get you, get you alone\nYour name has echoed through my mind\nAnd I just think you should, think you should know\nThat nothing safe is worth the drive\nAnd I will follow you, follow you home\nFollow you, follow you home\n\n[Chorus 2]\nThis hope is treacherous\nThis daydream is dangerous\nThis hope is treacherous\nI-I-I, I-I-I, I-I-I\n\n[Breakdown]\nTwo headlights shine through the sleepless night\nAnd I will get you, get you alone\nYour name has echoed through my mind\nAnd I just think you should, think you should know\nThat nothing safe is worth the drive\nAnd I will follow you, follow you home\nFollow you, follow you home\nI'll follow you, follow you home\nFollow you, follow you home\n\n[Outro]\nThis slope is treacherous\nI-I-I like it","102684","Treacherous","1177","Taylor Swift"
"[Verse 1]\nKnew he was a killer first time that I saw him\nWondered how many girls he had loved and left haunted\nBut if he's a ghost, then I can be a phantom\nHoldin' him for ransom, some\nSome boys are tryin' too hard, he don't try at all though\nYounger than my exes, but he act like such a man, so\nI see nothing better, I keep him forever\nLike a vendetta-ta\n\n[Pre-Chorus]\nI, I, I see how this is gon' go\nTouch me and you'll never be alone\nI-Island breeze and lights down low\nNo one has to know\n\n[Chorus]\nIn the middle of the night, in my dreams\nYou should see the things we do, baby\nIn the middle of the night, in my dreams\nI know I'm gonna be with you, so I take my time\nAre you ready for it?\n\n[Verse 2]\nKnew I was a robber first time that he saw me\nStealing hearts and running off and never sayin' sorry\nBut if I'm a thief, then he can join the heist, and\nWe'll move to an island, and\nAnd he can be my jailer, Burton to this Taylor\nEvery love I've known in comparison is a failure\nI forget their names now, I'm so very tame now\nNever be the same now, now\n\n[Pre-Chorus]\nI, I, I see how this is gon' go\nTouch me and you'll never be alone\nI-Island breeze and lights down low\nNo one has to know (No one has to know)\n\n[Chorus]\nIn the middle of the night, in my dreams\nYou should see the things we do, baby\nIn the middle of the night in my dreams\nI know I'm gonna be with you, so I take my time\nAre you ready for it?\nOh, are you ready for it?\n\n[Post-Chorus]\nBaby, let the games begin\nLet the games begin\nLet the games begin\nBaby, let the games begin\nLet the games begin\nLet the games begin\n\n[Pre-Chorus]\nI, I, I see how this is gon' go\nTouch me and you'll never be alone\nI-Island breeze and lights down low\nNo one has to know\n\n[Chorus]\nIn the middle of the night, in my dreams\nYou should see the things we do, baby\nIn the middle of the night, in my dreams\nI know I'm gonna be with you, so I take my time\nIn the middle of the night\n\n[Post-Chorus]\nBaby, let the games begin\nLet the games begin\nLet the games begin\nAre you ready for it?\nBaby, let the games begin\nLet the games begin\nLet the games begin\nAre you ready for it?","3221550","...Ready for It?","1177","Taylor Swift"
"[Verse 1]\nI, I loved you in secret\nFirst sight, yeah, we love without reason\nOh, twenty-five years old\nOh, how were you to know? And\nMy, my love had been frozen\nDeep blue, but you painted me golden\nOh, and you held me close\nOh, how was I to know? I–\n\n[Pre-Chorus]\nCould've spent forever with your hands in my pockets\nPicture of your face in an invisible locket\nYou said there was nothing in the world that could stop it\nI had a bad feeling\nAnd darling, you had turned my bed into a sacred oasis\nPeople started talking, putting us through our paces\nI knew there was no one in the world who could take it\nI had a bad feeling\n\n[Chorus]\nBut we were dancing\nDancing with our hands tied, hands tied\nYeah, we were dancing\nLike it was the first time, first time\nYeah, we were dancing\nDancing with our hands tied, hands tied\nYeah, we were dancing\nAnd I had a bad feeling\nBut we were dancing\n\n[Verse 2]\nI, I loved you in spite of\nDeep fears that the world would divide us\nSo, baby, can we dance?\nOh, through an avalanche? And\nSay, say that we got it\nI'm a mess, but I'm the mess that you wanted\nOh, 'cause it's gravity\nOh, keeping you with me, I–\n\n[Pre-Chorus]\nCould've spent forever with your hands in my pockets\nPicture of your face in an invisible locket\nYou said there was nothing in the world that could stop it\nI had a bad feeling\n\n[Chorus]\nBut we were dancing\nDancing with our hands tied, hands tied\nYeah, we were dancing\nLike it was the first time, first time\nYeah, we were dancing\nDancing with our hands tied, hands tied\nYeah, we were dancing\n(Knew we had our hands tied)\nAnd I had a bad feeling\nBut we were dancing\n\n[Bridge]\nI'd kiss you as the lights went out\nSwaying as the room burned down\nI'd hold you as the water rushes in\nIf I could dance with you again\nI'd kiss you as the lights went out\nSwaying as the room burned down\nI'd hold you as the water rushes in\nIf I could dance with you again\n(Again!)\n\n[Chorus]\nDancing with our hands tied, hands tied\nOh, yeah, we were dancing\nLike it was the first time, first time\nYeah, we were dancing (oh)\nDancing with our hands tied, hands tied\n(Dancing with our hands tied)\nYeah, we were dancing (ooh)\nAnd I had a bad feeling (had a bad feeling)\nBut we were dancing\n(Ooh-ooh, ooh-ooh)\nHands tied, hands tied\n(Dancing)","3306080","Dancing With Our Hands Tied","1177","Taylor Swift"
"[Verse 1]\nLast night, I heard my own heart beating\nSounded like footsteps on my stairs\nSix months gone and I'm still reaching\nEven though I know you're not there\nI was playing back a thousand memories, baby\nThinkin' 'bout everything we've been through\nMaybe I've been going back too much lately\nWhen time stood still and I had you\n\n[Chorus]\nCome back, come back, come back to me like\nYou would, you would if this was a movie\nStand in the rain outside till I came out\nCome back, come back, come back to me like\nYou could, you could if you just said you're sorry\nI know that we could work it out somehow\nBut if this was a movie you'd be here by now\n\n[Verse 2]\nI know people change and these things happen\nBut I remember how it was back then\nWrapped up in your arms and our friends were laughing\n'Cause nothing like this ever happened to them\nNow I'm pacing down the hall, chasing down your street\nFlashback to the night when you said to me\n""Nothing's gonna change, not for me and you""\nNot before I knew how much I had to lose\n\n[Chorus]\nCome back, come back, come back to me like\nYou would, you would if this was a movie\nStand in the rain outside till I came out\nCome back, come back, come back to me like\nYou could, you could if you just said you're sorry\nI know that we could work it out somehow\nBut if this was a movie you'd be here by now\n\n[Bridge]\nIf you're out there, if you're somewhere, if you're moving on\nI've been waiting for you, wary since you've been gone\nI just want it back the way it was before\nAnd I just want to see you back at my front door\n\n[Chorus - Variation]\nAnd I say, ""Come back, come back, come back to me like\nYou would before you said it's not that easy\nBefore the fight, before I locked you out""\nBut I take it all back now\n\n[Chorus]\nCome back, come back, come back to me like\nYou would, you would if this was a movie\nStand in the rain outside till I came out\nCome back, come back, come back to me like\nYou could, you could if you just said you're sorry\nI know that we could work it out somehow\nBut if this was a movie you'd be here by now\n\n[Outro]\nYou'd be here by now\nIt's not the kind of ending you want to see now\nBaby, what about the ending?\nOh, I thought you'd be here by now\nThought you'd be here by now","186961","If This Was a Movie","1177","Taylor Swift"
"[Verse 1]\nI see your face in my mind as I drive away\n'Cause none of us thought it was gonna end that way\nPeople are people and sometimes we change our minds\nBut it's killing me to see you go after all this time\n\nMm mm mm, mm mm mm, mm mm\nMm mm mm, mm mm mm, mm mm\n\nMusic starts playing like the end of a sad movie\nIt's the kind of ending you don't really want to see\n'Cause it's tragedy and it'll only bring you down\nNow I don't know what to be without you around\n\n[Pre-Chorus]\nAnd we know it's never simple, never easy\nNever a clean break, no one here to save me\nYou're the only thing I know like the back of my hand\n\n[Chorus]\nAnd I can't breathe without you but I have to\nBreathe without you but I have to\n\n[Verse 2]\nNever wanted this, never want to see you hurt\nEvery little bump in the road I tried to swerve\nBut people are people and sometimes it doesn't work out\nNothing we say is gonna save us from the fall out\n\n[Pre-Chorus]\nAnd we know it's never simple, never easy\nNever a clean break, no one here to save me\nYou're the only thing I know like the back of my hand\n\n[Chorus]\nAnd I can't breathe without you but I have to\nBreathe without you but I have to\n\n[Bridge]\nIt's 2 A.M, feeling like I just lost a friend\nHope you know it's not easy, easy for me\nIt's 2 A.M, feeling like I just lost a friend\nHope you know this ain't easy, easy for me\n\n[Pre-Chorus]\nAnd we know it's never simple, never easy\nNever a clean break, no one here to save me, oh\n\n[Chorus]\nI can't breathe without you but I have to\nBreathe without you but I have to\nBreathe without you but I have to\n\n[Outro]\nI'm sorry, I'm sorry\nI'm sorry, (Yeah eh) I'm sorry\nI'm sorry, I'm sorry\nI'm sorry","98894","Breathe (Ft. Colbie Caillat)","1177","Taylor Swift"
"[Verse 1]\nI don't know what I want, so don't ask me\nCause I'm still trying to figure it out\nDon't know what's down this road, I'm just walking\nTrying to see through the rain coming down\nEven though I'm not the only one\nWho feels the way I do\n\n[Chorus]\nI'm alone, on my own, and that's all I know\nI'll be strong, I'll be wrong, oh but life goes on\nOh, I'm just a girl, trying to find a place in this world\n\n[Verse 2]\nGot the radio on, my old blue jeans\nAnd I'm wearing my heart on my sleeve\nFeeling lucky today, got the sunshine\nCould you tell me what more do I need\nAnd tomorrow's just a mystery, oh yeah\nBut that's OK\n\n[Chorus]\nI'm alone, on my own, and that's all I know\nI'll be strong, I'll be wrong, oh but life goes on\nOh, I'm just a girl, trying to find a place in this world\n\n[Bridge]\nMaybe I'm just a girl on a mission\nBut I'm ready to fly\n\n[Chorus]\nI'm alone, on my own, and that's all I know\nI'll be strong, I'll be wrong, oh but life goes on\nOh I'm alone, on my own, and that's all I know\nOh I'm just a girl, trying to find a place in this world\n\n[Outro]\nOh I'm just a girl\nOh I'm just a girl, oh, oh\nOh I'm just a girl","132080","A Place In This World","1177","Taylor Swift"
"""These songs were once about my life. They are now about yours.""\n\nI was born in Reading, Pennsylvania on December 13, 1989.\n\nIn the world we live in, much is said about when we are born and when we die. Our birthday is celebrated every year to commemorate the very instant we came into the world. And a funeral is held to mark the day we leave it. But lately I've been wondering... what can be said of all the moments in between our birth and our death? The moments when we are reborn...\n\nThe debate over whether people change is an interesting one for me to observe because it seems like all I ever do is change. All I ever do is learn from my mistakes so I don't make the same ones again. Then I make new ones. I know people can change because it happens to me little by little every day. Every day I wake up as someone slightly new. Isn't it wild and intriguing and beautiful to think that every day we are new?\n\nFor the last few years, I've woken up every day not wanting, but needing to write a new style of music. I needed to change the way I told my stories and the way they sounded. I listened to a lot of music from the decade in which I was born and I listened to my intuition that it was a good thing to follow this gut feeling. I was also writing a different storyline than I'd ever told you before.\n\nI wrote about moving to the loudest and brightest city in the world, the city I had always been overwhelmed by... until now. I think you have to know who you are and what you want in order to take on New York and all its blaring truth. I wrote about the thrill I got when I finally learned that love, to some extent, is just a game of cat and mouse. I wrote about looking back on a lost love and understanding that nothing good comes without loss and hardship and constant struggle. There is no ""riding off into the sunset,"" like I used to imagine. We are never out of the woods, because we are always going to be fighting for something. I wrote about love that comes back to you just when you thought it was lost forever, and how some feelings never go out of style. I wrote about an important lesson I learned recently... that people can say whatever they want about me, but they can't make me lose my mind. I've learned how to shake things off.\n\nI've told you my stories for years now. Some have been about coming of age. Some have been about coming undone. This is a story about coming into your own, and as a result... coming alive.\n\nI hope you know that you've given me the courage to change. I hope you know that who you are is who you choose to be, and that whispers behind your back don't define you. You are the only person who gets to decide what you will be remembered for.\n\nFrom the girl who said she would never cut her hair or move to New York or find happiness in a world where she is not in love...\n\nLove, Taylor","2292967","1989 [Liner Notes]","1177","Taylor Swift"
"[Verse 1]\nThis is wrong but I can't help but feel like\nThere ain’t nothing more right babe\nMisty morning comes again and I can't\nHelp but wish I could see your face\nAnd I knew from the first note played\nI'd be breaking all my rules to see you\nYou smile that beautiful smile and all the girls in the front row\nScream your name\n\n[Chorus]\nSo dim that spotlight, tell me things like\nI can't take my eyes off of you\nI'm no one special, just another wide-eyed girl\nWho's desperately in love with you\nGive me a photograph to hang on my wall, superstar\n\n[Verse 2]\nGood morning loneliness\nComes around when I'm not dreaming about you\nWhen my world wakes up today\nYou'll be in another town\nAnd I knew when I saw your face\nI'd be counting down the ways to see you\nYou smile that beautiful smile and all the girls in the front row Scream your name\n\n[Chorus]\nSo dim that spotlight, tell me things like\nI can't take my eyes off of you\nI'm no one special, just another wide-eyed girl\nWho's desperately in love with you\nGive me a photograph to hang on my wall, superstar\n\n[Bridge]\nYou played in bars, you play guitar\nAnd I'm invisible and everyone knows who you are\nAnd you'll never see, you sing me to sleep\nEvery night from the radio\n\n[Chorus]\nSo dim that spotlight, tell me things like\nI can't take my eyes off of you\nI'm no one special, just another wide-eyed girl\nWho's desperately in love with you\nGive me a photograph to hang on my wall, superstar\n\n[Outro]\nSweet, sweet superstar, superstar...\nSuperstar","186915","SuperStar","1177","Taylor Swift"
"""Acting Like a Boy""\n""All Night Diner""\n""American Boy""\n""Am I Ready for Love""\n""Angelina""\n""Anymore""*\n""A Perfectly Good Heart (Studio Demo)""\n""A Place in This World (Studio Demo)""","3474805","Unreleased Songs [Discography List]","1177","Taylor Swift"
"[Verse 1]\nI was reminiscing just the other day\nWhile having coffee all alone, and Lord, it took me away\nBack to a first-glance feeling on New York time\nBack when you fit my poems like a perfect rhyme\nTook off faster than a green light, go\nHey, you skip the conversation when you already know\nI left a note on the door with a joke we'd made\nAnd that was the first day\n\n[Chorus]\nAnd darling, it was good\nNever looking down\nAnd right there where we stood\nWas holy ground\n\n[Verse 2]\nSpinning like a girl in a brand new dress\nWe had this big wide city all to ourselves\nWe blocked the noise with the sound of, ""I need you""\nAnd for the first time, I had something to lose\nAnd I guess we fell apart in the usual way\nAnd the story's got dust on every page\nBut sometimes, I wonder how you think about it now\nAnd I see your face in every crowd\n\n[Chorus]\n'Cause darling, it was good\nNever looking down\nAnd right there where we stood\nWas holy ground\n\n[Hook]\nTonight, I'm gonna dance\nFor all that we've been through\nBut I don't wanna dance\nIf I'm not dancing with you\nTonight, I'm gonna dance\nLike you were in this room\nBut I don't wanna dance\nIf I'm not dancing with you\n\n[Chorus]\nIt was good\nNever looking down\nAnd right there where we stood\nWas holy ground\n\n[Outro]\nTonight, I'm gonna dance\nFor all that we've been through\nBut I don't wanna dance\nIf I'm not dancing with you\nTonight, I'm gonna dance\nLike you were in this room\nBut I don't wanna dance\nIf I'm not dancing with you","102718","Holy Ground","1177","Taylor Swift"
"[Verse 1]\nThere's glitter on the floor after the party\nGirls carrying their shoes down in the lobby\nCandle wax and Polaroids on the hardwood floor\nYou and me from the night before, but\n\n[Chorus]\nDon’t read the last page\nBut I stay when you're lost, and I'm scared\nAnd you’re turning away\nI want your midnights\nBut I'll be cleaning up bottles with you on New Year's Day\n\n[Verse 2]\nYou squeeze my hand three times in the back of the taxi\nI can tell that it's gonna be a long road\nI'll be there if you're the toast of the town, babe\nOr if you strike out and you're crawling home\n\n[Chorus]\nDon't read the last page\nBut I stay when it’s hard, or it’s wrong\nOr we're making mistakes\nI want your midnights\nBut I’ll be cleaning up bottles with you on New Year's Day\n\n[Post-Chorus]\nHold on to the memories, they will hold on to you\nHold on to the memories, they will hold on to you\nHold on to the memories, they will hold on to you\nAnd I will hold on to you\n\n[Bridge]\nPlease don't ever become a stranger\nWhose laugh I could recognize anywhere\nPlease don't ever become a stranger\nWhose laugh I could recognize anywhere\n\n[Verse 3]\nThere’s glitter on the floor after the party\nGirls carrying their shoes down in the lobby\nCandle wax and Polaroids on the hardwood floor\nYou and me forevermore\n\n[Chorus]\nDon't read the last page\nBut I stay when it's hard, or it's wrong\nOr we're making mistakes\nI want your midnights\nBut I'll be cleaning up bottles with you on New Year's Day\n\n[Post-Chorus]\nHold on to the memories, they will hold on to you\nHold on to the memories, they will hold on to you\nHold on to the memories, they will hold on to you\nAnd I will hold on to you\n\n[Outro]\nPlease don't ever become a stranger\n(To the memories, they will hold on to you)\nWhose laugh I could recognize anywhere\n(Hold on to the memories, they will hold on to you)\nPlease don't ever become a stranger\n(Hold on to the memories, they will hold on to you)\nWhose laugh I could recognize anywhere\n(I will hold on to you)","3281524","New Year's Day","1177","Taylor Swift"
